name,profile_url,emails,org_number,revenue,legal_name,registration_date,company_type,employees,ceo,address,postal_address,city,share_capital,sni_codes,business_purpose,phone,website
Crosspeed AB,https://www.allabolag.se/foretag/crosspeed-ab/karlskoga/-/5592436900,[],559243-6900,2475,Crosspeed AB,2020-02-20,Aktiebolag,0,"Västra Lonntorp 156, 691 91 Karlskoga","Marko Jokinen Västra Lonntorp 156, 691 91 Karlskoga",Karlskoga,25,"['45310 Parti- och provisionshandel med reservdelar och tillbehör till motorfordon utom motorcyklar', '46710 Partihandel med bränslen']","Aktiebolaget ska bedriva handel med bil-, MC-däck och biltillbehör och till detta tillhörande verksamhet. Import av släpvagnar, försäljning samt uthyrning av släpvagnar, bilsimulatorer.",,,
VVS-Installatören i Fjugesta Aktiebolag,https://www.allabolag.se/foretag/vvs-installat%C3%B6ren-i-fjugesta-aktiebolag/fjugesta/-/5563665230,[],556366-5230,2473,VVS-Installatören i Fjugesta Aktiebolag,1989-08-09,Aktiebolag,2,"Edsbergs-Sörby, 716 91 Fjugesta","Edsbergs-Sörby, 716 91 Fjugesta",Fjugesta,100,['43221 Värme- och sanitetsarbeten'],"Bolaget skall bedriva försäljning och installation av VVS-artiklar, lantbruksverksamhet, handel med värdepapper samt annan därmed förenlig verksamhet.",,0585-280 65,
G:a Sågens Åkeri AB,https://www.allabolag.se/foretag/g%3Aa-s%C3%A5gens-%C3%A5keri-ab/kumla/-/5568445505,[],556844-5505,2472,G:a Sågens Åkeri AB,2011-03-07,Aktiebolag,1,"Ekeby-Björka 164 Åskulla Gård, 692 91 Kumla","Ekeby-Björka 164 Åskulla Gård, 692 91 Kumla",Kumla,50,"['49410 Vägtransport, godstrafik']","Föremålet för bolagets verksamhet är godstransporter på väg, uthyrning av arbetskraft samt handel med värdepapper och därmed förenlig verksamhet.",,,
W Performance AB,https://www.allabolag.se/foretag/w-performance-ab/hallsberg/-/5594726761,[],559472-6761,2471,W Performance AB,2024-02-19,Aktiebolag,1,"Elvas Gata 13, 694 37 Hallsberg","c/o Daniel Wilhelmsson Elvas Gata 13, 694 37 Hallsberg",Hallsberg,25,"['71121 Teknisk konsultverksamhet inom bygg- och anläggningsteknik', '43120 Mark- och grundarbeten']",Föremålet för bolagets verksamhet är konsultverksamhet inom projektledning och event och därmed förenlig verksamhet,Emil Daniel Wilhelmsson,,
LE Alltjänst AB,https://www.allabolag.se/foretag/le-alltj%C3%A4nst-ab/%C3%B6stansj%C3%B6/-/5569574279,[],556957-4279,2471,LE Alltjänst AB,2014-01-03,Aktiebolag,1,"Utsiktsgatan 4, 694 72 Östansjö","c/o Lars-Erik Bergström Utsiktsgatan 4, 694 72 Östansjö",Östansjö,50,['43991 Uthyrning av bygg- och anläggningsmaskiner med förare'],"Bolaget ska bedriva uthyrning av bygg- och anläggningsmaskiner samt försäljning av saluvaror, maskiner, tillbehör och utrustning kopplade till bygg- och anläggningssektorn, bedriva försäljning och uthyrning av fordon, äga och förvalta aktier och andra värde= papper, uthyrning av personal, rekryterings- och konsulttjänster inom personal- och arbetsmiljöområdet, äga och förvalta fastigheter samt annan därmed förenlig verksamhet.",,,
Delta Webbyrå AB,https://www.allabolag.se/foretag/delta-webbyr%C3%A5-ab/askersund/-/5591017511,"[""kontakt@delta.se"", ""kontakt@delta.se""]",559101-7511,2470,Delta Webbyrå AB,2017-02-22,Aktiebolag,2,"Trädgårdsgatan 5 B, 696 30 Askersund","Trädgårdsgatan 5 b, 696 30 Askersund",Askersund,50,['62010 Dataprogrammering'],Produktion av hemsidor och utveckling av webbaserade tjänster och funktioner.,Erik Magnus Gunnarsson,0583-130 30,https://www.delta.se/
zazr sushi AB,https://www.allabolag.se/foretag/zazr-sushi-ab/%C3%B6rebro/-/5591310031,[],559131-0031,2469,zazr sushi AB,2017-10-26,Aktiebolag,2,"Rudbecksgatan 145, 702 80 Örebro","SASHIMI SUSHI Rudbecksgatan 145, 702 80 Örebro",Örebro,50,['56100 Restaurangverksamhet'],SUSHI RESTAURANG,,,
Projektledning Fredrik Persson AB,https://www.allabolag.se/foretag/projektledning-fredrik-persson-ab/%C3%B6rebro/-/5594660663,[],559466-0663,2469,Projektledning Fredrik Persson AB,2024-01-02,Aktiebolag,1,"Västmannagatan 14, 703 42 Örebro","Västmannagatan 14, 703 42 Örebro",Örebro,25,['41100 Utformning av byggprojekt'],Företaget ska bedriva konsultverksamhet inom området byggande och fastighetsförvaltning.,,,
Håkan Hjorts Entreprenad AB,https://www.allabolag.se/foretag/h%C3%A5kan-hjorts-entreprenad-ab/karlskoga/-/5569110660,[],556911-0660,2468,Håkan Hjorts Entreprenad AB,2012-11-20,Aktiebolag,1,"Bofors Industriområde, 691 50 Karlskoga","Bofors Industriområde, 691 50 Karlskoga",Karlskoga,50,"['49410 Vägtransport, godstrafik', '25610 Beläggning och överdragning av metall']","Bolaget skall bedriva transporttjänster, personaluthyrning och markarbeten såsom schaktning, snöröjning och grävning samt därmed förenlig verksamhet. Bolaget skall även bedriva konsulttjänster inom ovan angivna områden samt inom ytbehandling, beläggning och målning av metallföremål.",,,
Månsson Golfutveckling AB,https://www.allabolag.se/foretag/m%C3%A5nsson-golfutveckling-ab/%C3%B6rebro/-/5592720477,[],559272-0477,2467,Månsson Golfutveckling AB,2020-09-17,Aktiebolag,1,"Oskarsvägen 4 b, 702 14 Örebro","Oskarsvägen 4 b, 702 14 Örebro",Örebro,25,['74102 Grafisk designverksamhet'],Produktion av banguider till golfbanor och därmed förenlig verksamhet,,,
VOPAB i Kumla AB,https://www.allabolag.se/foretag/vopab-i-kumla-ab/kumla/-/5565234845,[],556523-4845,2466,VOPAB i Kumla AB,1995-07-26,Aktiebolag,1,"Älvestavägen 10, 692 92 Kumla","Älvestavägen 10, 692 92 Kumla",Kumla,100,"['68202 Uthyrning och förvaltning av egna eller arrenderade industrilokaler', '61200 Trådlös telekommunikation']","Bolaget skall bedriva fastighetsförvaltning, konstruktion inom el samt förädling av profilprodukter.",,,
Heberg Lantbruk AB,https://www.allabolag.se/foretag/heberg-lantbruk-ab/fjugesta/-/5591975338,[],559197-5338,2465,Heberg Lantbruk AB,2019-03-05,Aktiebolag,0,"Binninge Dansgården, 716 91 Fjugesta","Binninge Dansgården, 716 91 Fjugesta",Fjugesta,50,['68202 Uthyrning och förvaltning av egna eller arrenderade industrilokaler'],Föremålet för bolagets verksamhet är att äga och förvalta fast egendom samt bedriva därmed förenlig verksamhet.,,,
ML-Trä AB,https://www.allabolag.se/foretag/ml-tr%C3%A4-ab/%C3%B6rebro/-/5566253745,[],556625-3745,2464,ML-Trä AB,2002-04-02,Aktiebolag,2,"Dyringe 326, 705 94 Örebro","Dyringe 326, 705 94 Örebro",Örebro,100,['16240 Träförpackningstillverkning'],Bolaget skall bedriva tillverkning och försäljning av träprodukter och därmed förenlig verksamhet.,,019-24 12 44,
Alpäng Bygg & Montage AB,https://www.allabolag.se/foretag/alp%C3%A4ng-bygg-montage-ab/%C3%B6rebro/-/5590368113,[],559036-8113,2464,Alpäng Bygg & Montage AB,2015-11-24,Aktiebolag,1,"Holmgatan 12, 703 58 Örebro","Holmgatan 12, 703 58 Örebro",Örebro,50,['43320 Byggnadssnickeriarbeten'],"Bolaget ska bedriva bygg-, design- och inredningsverksamhet, äga och förvalta fast och lös egendom samt därmed förenlig verksamhet.",,,
Gyllet Holding AB,https://www.allabolag.se/foretag/gyllet-holding-ab/%C3%B6rebro/-/5592602212,[],559260-2212,2462,Gyllet Holding AB,2020-06-18,Aktiebolag,0,"Vasagatan 15, 702 10 Örebro","c/o Vaza konditori i Örebro AB Vasagatan 15, 702 10 Örebro",Örebro,25,['68201 Uthyrning och förvaltning av egna eller arrenderade bostäder'],Bolagets verksamhet skall bestå av att investera i aktier i andra företag,,,
EMBERO AB,https://www.allabolag.se/foretag/embero-ab/kumla/-/5568889769,[],556888-9769,2462,EMBERO AB,2012-03-28,Aktiebolag,2,"Östra Gatan 51, 692 31 Kumla","Seyed najibollah Moosawi Östra Gatan 51, 692 31 Kumla",Kumla,50,['56100 Restaurangverksamhet'],Bolaget ska bedriva försäljning av varm och kall mat samt därmed förenlig verksamhet.,Seyed Najibollah Moosawi,,
Bygg och Juridik i Örebro AB,https://www.allabolag.se/foretag/bygg-och-juridik-i-%C3%B6rebro-ab/%C3%B6rebro/-/5590582770,[],559058-2770,2462,Bygg och Juridik i Örebro AB,2016-04-11,Aktiebolag,1-4,"Nejlikegatan 11, 703 53 Örebro","Nejlikegatan 11, 703 53 Örebro",Örebro,50,"['41200 Byggande av bostadshus och andra byggnader', '69102 Juridiska byråers verksamhet m.m.', '69201 Redovisning och bokföring']",Bolaget ska bedriva byggnadsverksamhet samt därmed förenlig verksamhet. Bolaget ska även syssla med konsultverksamhet som avser juridiska uppdrag och rådgivning samt uthyrning av byggarbetskraft till andra bolag.,,,
Ronny Olssons el och vitvaruservice AB,https://www.allabolag.se/foretag/ronny-olssons-el-och-vitvaruservice-ab/%C3%B6rebro/-/5569471435,[],556947-1435,2460,Ronny Olssons el och vitvaruservice AB,2013-10-30,Aktiebolag,2,"Cv-Gatan 109 Lgh 1003, 703 82 Örebro","Cv-Gatan 109 Lgh 1003, 703 82 Örebro",Örebro,50,['43210 Elinstallationer'],"Elinstallationer, reparationer och försäljning av elmaterial, service, reparationer och försäljning av vitvaror, in och utvändig service och underhåll av fastigheter, förvaltning av värdepapper",Jan Ronny Olsson,,
Zeunerts i Norrland AB,https://www.allabolag.se/foretag/zeunerts-i-norrland-ab/kopparberg/-/5565024337,[],556502-4337,2457,Zeunerts i Norrland AB,1994-12-19,Aktiebolag,0,"Klotenvägen 1, 714 35 Kopparberg","Kopparbergs Bryggeri Ab, 714 82 Kopparberg",Kopparberg,100,['11050 Framställning av öl'],"Bolaget bedriver tillverkning av och handel med vin, öl, andra maltdrycker och kolsyrade drycker, bedriva depåverksamhet med egna bilar, äga och förvalta fastigheter och därmed förenlig verksamhet.",Peter Gunnar Bronsman,0620-575 00,
GPA Entreprenad AB,https://www.allabolag.se/foretag/gpa-entreprenad-ab/vretstorp/-/5593260747,[],559326-0747,2454,GPA Entreprenad AB,2021-07-05,Aktiebolag,1,"Torpa 213, 694 94 Vretstorp","Torpa 213, 694 94 Vretstorp",Vretstorp,25,"['42110 Anläggning av vägar och motorvägar', '02409 Övrig service till skogsbruk']",Bolaget skall erbjuda bransch specifika tjänster såsom geodetisk mätning och säkerhets personal samt manuella skogsvårds uppdrag,,,
Scandinavia station food AB,https://www.allabolag.se/foretag/scandinavia-station-food-ab/%C3%B6rebro/-/5590300785,[],559030-0785,2453,Scandinavia station food AB,2015-10-13,Aktiebolag,3,"Östra Bangatan 1 a, 703 39 Örebro","DURAID ADEL Östra Bangatan 1 a, 703 39 Örebro",Örebro,100,"['47112 Livsmedelshandel med brett sortiment, ej varuhus eller stormarknad', '47260 Specialiserad butikshandel med tobaksvaror', '47593 Specialiserad butikshandel med glas, porslin och andra bosättningsvaror', '56100 Restaurangverksamhet']",Bolaget skall bedriva restaurangverksamhet samt därmed förenlig verksamhet. Aktiebolaget ska bedriva taxirörelse samt därmed förenlig verksamhet.,,,
Tommy Ståhl Management AB,https://www.allabolag.se/foretag/tommy-st%C3%A5hl-management-ab/%C3%B6rebro/-/5590696919,[],559069-6919,2452,Tommy Ståhl Management AB,2016-07-07,Aktiebolag,1,"Nygatan 15 2tr, 702 11 Örebro","Nygatan 15 2tr, 702 11 Örebro",Örebro,50,['70220 Konsultverksamhet avseende företags organisation'],Konsultverksamhet affärsutveckling och IT och därmed förenlig verksamhet.,,,
Aktiebolaget Hessels Transporttjänst,https://www.allabolag.se/foretag/aktiebolaget-hessels-transporttj%C3%A4nst/kumla/-/5562446897,[],556244-6897,2452,Aktiebolaget Hessels Transporttjänst,1984-05-29,Aktiebolag,2,"Fjugestavägen 39, 692 73 Kumla","Magnus Hessel Fjugestavägen 39, 692 73 Kumla",Kumla,100,"['49410 Vägtransport, godstrafik']",Bolaget skall bedriva åkerirörelse ävensom idka därmed förenlig verksamhet.,,,
Karlssons Spår & Mark AB,https://www.allabolag.se/foretag/karlssons-sp%C3%A5r-mark-ab/hallsberg/-/5590229265,[],559022-9265,2451,Karlssons Spår & Mark AB,2015-08-13,Aktiebolag,1,"Samsalagatan 41, 694 92 Hallsberg","Samsalagatan 41, 694 92 Hallsberg",Hallsberg,50,['43120 Mark- och grundarbeten'],"Föremålet för bolagets verksamhet är markentreprenader, uthyrning av arbetskraft, uthyrning av byggverktyg samt handel med värde- papper och därmed förenlig verksamhet.",,,
VDT Konsult i Nerike AB,https://www.allabolag.se/foretag/vdt-konsult-i-nerike-ab/%C3%B6rebro/-/5591173538,[],559117-3538,2449,VDT Konsult i Nerike AB,2017-06-29,Aktiebolag,0,"Drottninggatan 15, 702 10 Örebro","Drottninggatan 15, 702 10 Örebro",Örebro,75,['71200 Teknisk provning och analys'],Bolaget ska bedriva konsultarbeten inom transportsystem omfattande hissar och rulltrappor och därmed förenlig verksamhet.,,,
Magnus Ekströms Transporter Aktiebolag,https://www.allabolag.se/foretag/magnus-ekstr%C3%B6ms-transporter-aktiebolag/h%C3%A4llefors/-/5566275060,[],556627-5060,2449,Magnus Ekströms Transporter Aktiebolag,2002-05-21,Aktiebolag,1,"Grävlingsvägen 1, 712 33 Hällefors","Grävlingsvägen 1, 712 33 Hällefors",Hällefors,100,"['49410 Vägtransport, godstrafik']","Bolaget skall bedriva transporter, äga och förvalta värdepapper och därmed förenlig verksamhet.",,0591-163 84,
Kurtfast AB,https://www.allabolag.se/foretag/kurtfast-ab/%C3%B6rebro/-/5568891955,[],556889-1955,2449,Kurtfast AB,2012-03-29,Aktiebolag,0,"Vasagatan 15, 702 10 Örebro","c/o Vasa Konditori Vasagatan 15, 702 10 Örebro",Örebro,400,['68201 Uthyrning och förvaltning av egna eller arrenderade bostäder'],"Föremålet för bolagets verksamhet är att bedriva köp och förvaltning av fastigheter, uthyrning av lägenheter och affärslokaler samt därmed förenlig verksamhet.",,,
Marcimain Film AB,https://www.allabolag.se/foretag/marcimain-film-ab/%C3%B6rebro/-/5567010268,[],556701-0268,2448,Marcimain Film AB,2006-03-31,Aktiebolag,1,Örebro,"Box 103, 701 42 Örebro",Örebro,100,"['90030 Litterärt och konstnärligt skapande', '90010 Artistisk verksamhet', '90020 Stödtjänster till artistisk verksamhet']","Bolaget skall idka producerande verksamhet. konsultverksamhet, förlagsverksamhet, konstnärlig verksamhet, litterär verksamhet, artistverksamhet, kompositörsverksamhet, textverksamhet, arrangörsverksamhet och handelsrörelse inom marknadsföring, PR, reklam, konst, bok, film, video, radio, TV, grammofon, musik, nöjes och teaterbranchen samt idka därmed förenlig verksamhet. Därjämte kan bolaget köpa, sälja och förvalta aktier, obligationer, reverser, andelar, fastigheter samt köpa och sälja administrativa tjänster, ingå borgensåtaganden, samt idka därmed förenlig verksamhet, dock ej sådan verksamhet som avses i lag om bankrörelse eller lag om finansieringsverksamhet. Tillika äger bolaget rätt att för dotterbolag och närbesläktade företag ingå borgensåtaganden och till dessa lämna lån och därmed förenlig verksamhet.",,,
H-Gate AB,https://www.allabolag.se/foretag/h-gate-ab/%C3%B6rebro/-/5594082678,[],559408-2678,2447,H-Gate AB,2022-11-28,Aktiebolag,3,"Varbergagatan 97 Lgh 1303, 703 51 Örebro","Varbergagatan 97 Lgh 1303, 703 51 Örebro",Örebro,25,"['78200 Personaluthyrning', '86211 Primärvårdsmottagningar med läkare m.m.', '64993 Förvaltning av och handel med värdepapper för en begränsad och sluten krets av ägare']",Företaget ska bedriva konsultverksamhet inom Medicinsk konsulttjänster.,,,
NaturEvent Eliasons AB,https://www.allabolag.se/foretag/naturevent-eliasons-ab/%C3%B6rebro/-/5566348966,[],556634-8966,2445,NaturEvent Eliasons AB,2002-11-04,Aktiebolag,2,"Våghustorget 3, 702 10 Örebro","Våghustorget 3, 702 10 Örebro",Örebro,100,"['85599 Diverse övrig utbildning', '86905 Fysioterapeutisk verksamhet  o.d.']","Bolaget skall bedriva verksamhet med naprapati, rehabilitering, utbildning inom hälsovård, natur och kultur inom hembygden, kurs och konferensverksamhet samt idka därmed förenlig verksamhet. Stuguthyrning , restaurang och cafe.",Per-Magnus Eliasson,,
LSS-fastigheter i Dalarna AB,https://www.allabolag.se/foretag/lss-fastigheter-i-dalarna-ab/%C3%B6rebro/-/5593602989,[],559360-2989,2445,LSS-fastigheter i Dalarna AB,2022-01-14,Aktiebolag,0,"Olaigatan 17 b 1tr, 703 61 Örebro","Olaigatan 17 b 1tr, 703 61 Örebro",Örebro,25,"['68203 Uthyrning och förvaltning av egna eller arrenderade, andra lokaler']",Bolaget ska äga och förvalta fastigheter och bedriva därmed förenlig verksamhet.,,,
Granbergsdals Bygg AB,https://www.allabolag.se/foretag/granbergsdals-bygg-ab/granbergsdal/-/5591085237,[],559108-5237,2445,Granbergsdals Bygg AB,2017-04-11,Aktiebolag,2,"Granbergsdal Luggavi 492, 691 92 Granbergsdal","Granbergsdal Luggavi 492, 691 92 Granbergsdal",Granbergsdal,100,['43320 Byggnadssnickeriarbeten'],"Bolaget ska tillhandahålla byggtjänster såsom reparationsjobb, snickeriarbeten, trädgårdstjänster, uthyrning av främst släpkärror, skyliftar, minigrävare och betongblandare samt därmed förenlig verksamhet.",Joakim Oskar Thunberg,,
Radiologen NM AB,https://www.allabolag.se/foretag/radiologen-nm-ab/%C3%B6rebro/-/5593880676,[],559388-0676,2442,Radiologen NM AB,2022-07-05,Aktiebolag,1,"Cv-Gatan 107 a 1102, 703 82 Örebro","Cv-Gatan 107 a 1102, 703 82 Örebro",Örebro,25,"['86221 Specialistläkarverksamhet inom öppenvård, på sjukhus']",Bolaget kommer bedriva verksamhet inom radiologisk diagnostik som läkarkonsult.,,,
Ahléns VVS & Värmepumpsteknik AB,https://www.allabolag.se/foretag/ahl%C3%A9ns-vvs-v%C3%A4rmepumpsteknik-ab/fjugesta/-/5594303207,[],559430-3207,2442,Ahléns VVS & Värmepumpsteknik AB,2023-04-14,Aktiebolag,1-4,"Hagagatan 25, 716 31 Fjugesta","Hagagatan 25, 716 31 Fjugesta",Fjugesta,25,['43221 Värme- och sanitetsarbeten'],"Bolaget ska bedriva verksamhet inom VVS, köp och försäljning samt installationer och service av värmepumpar samt därmed förenlig verksamhet. Bolaget ska bedriva handel med värdepapper. Bolaget skall även tillhandahålla uthyrning av personal.",,,
Tingsvalvet Tärnan 14 AB,https://www.allabolag.se/foretag/tingsvalvet-t%C3%A4rnan-14-ab/karlskoga/-/5593926354,[],559392-6354,2441,Tingsvalvet Tärnan 14 AB,2022-08-16,Aktiebolag,0,"Bangatan 9-11, 691 31 Karlskoga","Mått Johanssons Väg 52 a, 633 46 Eskilstuna",Eskilstuna,25,"['68203 Uthyrning och förvaltning av egna eller arrenderade, andra lokaler']",Bolaget ska äga och förvalta fast och lös egendom samt därmed förenlig verksamhet.,Sven Håkan Karlsson,,
Kumla Redovisningskonsult AB,https://www.allabolag.se/foretag/kumla-redovisningskonsult-ab/%C3%B6rebro/-/5567382204,[],556738-2204,2440,Kumla Redovisningskonsult AB,2007-09-18,Aktiebolag,2,"Nastagatan 10 c, 702 27 Örebro","Nastagatan 10 c, 702 27 Örebro",Örebro,100,['69201 Redovisning och bokföring'],"Bolaget skall bedriva redovisning, bokföring, revision och skatterådgivning och där tillhörande verksamhet.",Eva Carina Olsson,,
Leew Ekonomi AB,https://www.allabolag.se/foretag/leew-ekonomi-ab/fjugesta/-/5592129828,[],559212-9828,2439,Leew Ekonomi AB,2019-07-22,Aktiebolag,2,"Vallgatan 43, 716 31 Fjugesta","Vallgatan 43, 716 31 Fjugesta",Fjugesta,50,['69201 Redovisning och bokföring'],"Aktiebolaget ska arbeta med redovisning, ekonomisk konsultverksamhet, samt annan därmed förenlig verksamhet.",,,
UG INTERIM AB,https://www.allabolag.se/foretag/ug-interim-ab/hammar/-/5594213323,[],559421-3323,2438,UG INTERIM AB,2023-02-08,Aktiebolag,1,"Solvik 433, 696 94 Hammar","c/o Ulf Gustavsson Solvik 433, 696 94 Hammar",Hammar,25,['70220 Konsultverksamhet avseende företags organisation'],"Bolaget bedriver uthyrning som konsult eller interim inom organisation, ledarskapsutveckling och logistik",,,
Hallsbergs Bilbolag Aktiebolag,https://www.allabolag.se/foretag/hallsbergs-bilbolag-aktiebolag/hallsberg/-/5562042647,[],556204-2647,2436,Hallsbergs Bilbolag Aktiebolag,1980-01-01,Aktiebolag,2,"Brogatan 15, 694 31 Hallsberg","Brogatan 15, 694 31 Hallsberg",Hallsberg,100,"['45110 Handel med personbilar och lätta motorfordon', '25610 Beläggning och överdragning av metall', '45201 Allmän service och reparation av motorfordon utom motorcyklar']","Bolaget skall driva handel med nya och begagnade motorfordon, ävensom idka därmed förenlig verksamhet.",,,
Komprimera i Norden AB,https://www.allabolag.se/foretag/komprimera-i-norden-ab/%C3%B6rebro/-/5592880990,[],559288-0990,2434,Komprimera i Norden AB,2020-12-08,Aktiebolag,1,"Kabelvägen 5, 703 75 Örebro","- Kabelvägen 5, 703 75 Örebro",Örebro,30,['46900 Övrig partihandel'],Försäljning av produkter för avfallshantering.,,,
Vretstorps Byggmontage AB,https://www.allabolag.se/foretag/vretstorps-byggmontage-ab/vretstorp/-/5593113771,[],559311-3771,2433,Vretstorps Byggmontage AB,2021-04-12,Aktiebolag,2,"Ekbäcksvägen 69, 694 50 Vretstorp","c/o Johan Engström Ekbäcksvägen 69, 694 50 Vretstorp",Vretstorp,25,['43320 Byggnadssnickeriarbeten'],"Byggbranschen. Byggmontage, montage av lättbetong, montage av industrilokaler och lagerlokaler Byggentreprenad, förare av lastmaskin, teleskoplastare.",,,
Solida Lön & Ekonomi AB,https://www.allabolag.se/foretag/solida-l%C3%B6n-ekonomi-ab/%C3%B6rebro/-/5592101413,[],559210-1413,2433,Solida Lön & Ekonomi AB,2019-06-25,Aktiebolag,1,"Salamadervägen 21, 702 36 Örebro","Linda Andersson Salamadervägen 21, 702 36 Örebro",Örebro,50,"['69201 Redovisning och bokföring', '77120 Uthyrning och leasing av lastbilar och andra tunga motorfordon']","Bolaget skall bedriva konsultverksamhet med löner, HR- frågor, arbetsrätt, bokföring, bokslut, årsredovisning, deklarationer, uthyrning av fordon, handel med värdepapper och därmed förenlig verksamhet.",,,
Kazanci Restaurang AB,https://www.allabolag.se/foretag/kazanci-restaurang-ab/%C3%B6rebro/-/5594805391,[],559480-5391,2433,Kazanci Restaurang AB,2024-04-19,Aktiebolag,5-9,"Mejramvägen 113, 702 18 Örebro","Mejramvägen 113, 702 18 Örebro",Örebro,25,['56100 Restaurangverksamhet'],Bolaget ska bedriva restaurang och därmed förenlig verksamhet.,,,
CKarlsson AB,https://www.allabolag.se/foretag/ckarlsson-ab/%C3%B6rebro/-/5594184979,[],559418-4979,2433,CKarlsson AB,2023-01-19,Aktiebolag,1,"Ekoxevägen 18, 702 30 Örebro","c/o Christoffer Karlsson Ekoxevägen 18, 702 30 Örebro",Örebro,25,['62020 Datakonsultverksamhet'],"Företaget ska bedriva konsultverksamhet inom IT, samt utveckla mjukvaruprodukter. Företaget ska även äga och förvalta värdepapper och utöva därmed förenlig verksamhet.",,,
Advokat Maria Harr AB,https://www.allabolag.se/foretag/advokat-maria-harr-ab/%C3%B6rebro/-/5590369772,[],559036-9772,2433,Advokat Maria Harr AB,2015-11-25,Aktiebolag,1,"Olaigatan 17 c, 703 61 Örebro","Advokatbyrån Hagstedt & Bokvist Olaigatan 17 c, 703 61 Örebro",Örebro,50,['69101 Advokatbyråverksamhet'],Bolaget ska bedriva advokatbyrå.,,,
Närkerevision AB,https://www.allabolag.se/foretag/n%C3%A4rkerevision-ab/%C3%B6rebro/-/5590711403,[],559071-1403,2432,Närkerevision AB,2016-07-21,Aktiebolag,1,"Engelbrektsgatan 6 4 Tr, 702 12 Örebro","Engelbrektsgatan 6 4 Tr, 702 12 Örebro",Örebro,50,['69202 Revision'],Bolaget ska bedriva yrkesmässig revisionsverksamhet samt därmed förenlig verksamhet.,Lars Benny Uman,,
Brego Bygg AB,https://www.allabolag.se/foretag/brego-bygg-ab/hallsberg/-/5569006322,[],556900-6322,2432,Brego Bygg AB,2012-08-15,Aktiebolag,1,,"Järsjö 170, 694 91 Hallsberg",Hallsberg,50,['41200 Byggande av bostadshus och andra byggnader'],"Bolagets verksamhet skall bestå av bygg- och renoveringstjänster, servicetjänster inom fastighetsskötsel, entreprenad för byggande och liknande verksamhet",,,
Knut Produktion i Örebro AB,https://www.allabolag.se/foretag/knut-produktion-i-%C3%B6rebro-ab/%C3%B6rebro/-/5567344790,[],556734-4790,2427,Knut Produktion i Örebro AB,2007-07-09,Aktiebolag,0,"Oskarsparken 11, 702 12 Örebro","Oskarsparken 11, 702 12 Örebro",Örebro,100,"['79120 Researrangemang', '82300 Arrangemang av kongresser och mässor']","Bolaget ska bedriva resor, konferanser och andra arrangemang såsom konstutställningar, programledare samt massage.",,019-10 25 17,
Katrinelund i Närke AB,https://www.allabolag.se/foretag/katrinelund-i-n%C3%A4rke-ab/stora-mell%C3%B6sa/-/5567357487,[],556735-7487,2426,Katrinelund i Närke AB,2007-08-07,Aktiebolag,1,"Katrinelund 470, 715 92 Stora Mellösa","Katrinelund 470, 715 92 Stora Mellösa",Stora Mellösa,100,"['55101 Hotellverksamhet med restaurangrörelse', '55202 Stugbyverksamhet m.m.']","Bolaget skall bedriva hotell-och konferensverksamhet, förvaltning av fastigheter och aktier samt därmed förenlig verksamhet.",,,
Abbas Farhadi AB,https://www.allabolag.se/foretag/abbas-farhadi-ab/%C3%B6rebro/-/5591613723,[],559161-3723,2425,Abbas Farhadi AB,2018-06-04,Aktiebolag,1,"Ragnevägen 21, 702 17 Örebro","Ragnevägen 21 Ragnevägen 21, 702 17 Örebro",Örebro,50,['86211 Primärvårdsmottagningar med läkare m.m.'],Bolaget ska bedriva primärvård samt därmed förenlig verksamhet.,,,
Eklunda Golv & Kakel AB,https://www.allabolag.se/foretag/eklunda-golv-kakel-ab/%C3%B6rebro/-/5568959596,[],556895-9596,2423,Eklunda Golv & Kakel AB,2012-06-13,Aktiebolag,2,"Hemvärnsvägen 17, 702 25 Örebro","Hemvärnsvägen 17, 702 25 Örebro",Örebro,50,['43330 Golv- och väggbeläggningsarbeten'],"Bolaget ska bedriva golvläggning och kakelsättning, samt därmed förenlig verksamhet.",,,
Dr. Fred's Läkarservice AB,https://www.allabolag.se/foretag/dr.-freds-l%C3%A4karservice-ab/kumla/-/5569245730,[],556924-5730,2422,Dr. Fred's Läkarservice AB,2013-02-28,Aktiebolag,1-4,"Hagendalsvägen 1 1tr, 692 30 Kumla","Hagendalsvägen 1 1tr, 692 30 Kumla",Kumla,50,"['86211 Primärvårdsmottagningar med läkare m.m.', '47993 Ambulerande och tillfällig handel med övriga varor']","Bolaget ska bedriva hälso- och sjukvårdsverksamhet, forskning och utbildning i anslutning härtill och därmed förenlig verksamhet.",,,
Tin Jar AB,https://www.allabolag.se/foretag/tin-jar-ab/lax%C3%A5/-/5593457459,[],559345-7459,2421,Tin Jar AB,2021-11-11,Aktiebolag,0,"Gamla Tivägen 3, 695 32 Laxå","Tin Jar AB Gamla Tivägen 3, 695 32 Laxå",Laxå,25,['47911 Postorderhandel och detaljhandel på Internet med brett sortiment'],"Föremålet för bolagets verksamhet är att bedriva internethandel med presentartiklar och svenska livsmedelsvaror såsom godis, snus, konxerver för export och därmed föreblig verksamhet.",,,
